{
  "annotations": [],
  "boundaries": [
    {
      "attrs": {
        "automatic": true
      },
      "id": "boundary-000000",
      "kind": "sentence",
      "origin": "planner",
      "position": 4,
      "seconds": null,
      "strength": "sentence"
    }
  ],
  "config": {
    "diagnostics": true,
    "document_format": "ssmd",
    "language": "en-us",
    "language_aliases": {},
    "linguistics": {
      "require_spacy": false,
      "spacy_model": null,
      "spacy_model_size": null,
      "use_spacy": null
    },
    "overlap_mode": "snap",
    "pauses": {
      "clause": 0.3,
      "enabled": true,
      "mode": "tts",
      "paragraph": 1.0,
      "parenthetical": 0.15,
      "sentence": 0.6,
      "voice_change": 0.15,
      "weak": 0.15
    },
    "renderability_mode": "strict",
    "ssmd": {
      "parse_yaml_header": true,
      "pause_overrides": null
    },
    "text_preparation": "spokenform",
    "unit": "sentence"
  },
  "diagnostics": [
    {
      "code": "planning.complete",
      "message": "Plan compiled without renderer or audio processing",
      "path": null,
      "severity": "info"
    }
  ],
  "document_metadata": {
    "header": {},
    "planning": {
      "engine_independent": true,
      "linguistic_passes": 2,
      "pass_a_tokens": 2,
      "renderability": {
        "checked_segments": 2,
        "guaranteed": true,
        "mode": "strict",
        "repair_count": 0
      }
    },
    "sequence_fallback_mode": "spell"
  },
  "format": "utterplan",
  "languages": [
    {
      "id": "lang-0",
      "language": "en-us",
      "source": "document-default",
      "spoken_end": 9,
      "spoken_start": 0
    }
  ],
  "linguistic_runs": [
    {
      "language_run_id": "lang-0",
      "model": null,
      "model_version": null,
      "provider": "fallback",
      "provider_version": null,
      "token_end": 2,
      "token_start": 0
    }
  ],
  "markers": [
    {
      "attrs": {
        "name": "mark"
      },
      "id": "marker-000000",
      "name": "mark",
      "spoken_position": 4
    }
  ],
  "plan_id": "sha256:832da1920ee62e9be08b9d5a29baee31e09cec1a7e6b0e7342b2e6646877af14",
  "preparation": {
    "backend": "spokenform",
    "languages": ["en-us"],
    "replacements": [],
    "version": "0.4.5",
    "warnings": []
  },
  "producer": {
    "name": "utterplan",
    "version": "0.3.7"
  },
  "schema_version": 4,
  "segments": [
    {
      "annotation_ids": [],
      "clause": 0,
      "directives": {},
      "id": "seg-000000",
      "language": "en-us",
      "paragraph": 0,
      "pause_after": {
        "events": ["boundary-000000"],
        "seconds": 0.6
      },
      "pause_before": {
        "events": [],
        "seconds": 0.0
      },
      "sentence": 0,
      "spoken_end": 4,
      "spoken_start": 0,
      "structural_end": 4,
      "structural_start": 0,
      "text": "One.",
      "token_indices": [0]
    },
    {
      "annotation_ids": [],
      "clause": 0,
      "directives": {},
      "id": "seg-000001",
      "language": "en-us",
      "paragraph": 0,
      "pause_after": {
        "events": [],
        "seconds": 0.0
      },
      "pause_before": {
        "events": [],
        "seconds": 0.0
      },
      "sentence": 1,
      "spoken_end": 9,
      "spoken_start": 5,
      "structural_end": 9,
      "structural_start": 5,
      "text": "Two.",
      "token_indices": [1]
    }
  ],
  "semantic_boundaries": [
    {
      "id": "semantic-boundary-000000",
      "kind": "sentence",
      "language_run_id": null,
      "origin": "planner",
      "position": 4
    }
  ],
  "source": {
    "format": "ssmd",
    "text": "One. @mark Two."
  },
  "texts": {
    "spoken": "One. Two.",
    "structural": "One. Two."
  },
  "tokens": [
    {
      "id": "token-0",
      "language": "en-us",
      "lemma": "one.",
      "morph": null,
      "spoken_end": 4,
      "spoken_start": 0,
      "text": "One."
    },
    {
      "id": "token-1",
      "language": "en-us",
      "lemma": "two.",
      "morph": null,
      "spoken_end": 9,
      "spoken_start": 5,
      "text": "Two."
    }
  ],
  "units": [
    {
      "content_hash": "sha256:06421a7596d30e3d131ff1be9bcfc554f1441315d56b69a600eab58016c3556a",
      "content_hash_schema": "utterplan-unit-v3",
      "id": "unit-0000",
      "index": 0,
      "kind": "sentence",
      "marker_ids": [],
      "segment_ids": ["seg-000000"],
      "spoken_end": 4,
      "spoken_start": 0
    },
    {
      "content_hash": "sha256:55540601a312efce01e22b027b6438ca5969c331c9a4d77c67a1c750cc2e0ce5",
      "content_hash_schema": "utterplan-unit-v3",
      "id": "unit-0001",
      "index": 1,
      "kind": "sentence",
      "marker_ids": ["marker-000000"],
      "segment_ids": ["seg-000001"],
      "spoken_end": 9,
      "spoken_start": 5
    }
  ],
  "warnings": []
}
