{
  "annotations": [],
  "boundaries": [],
  "config": {
    "diagnostics": true,
    "document_format": "plain",
    "language": "en-us",
    "language_aliases": {},
    "linguistics": {
      "require_spacy": false,
      "spacy_model": null,
      "spacy_model_size": null,
      "use_spacy": null
    },
    "overlap_mode": "snap",
    "pauses": {
      "clause": 0.3,
      "enabled": true,
      "mode": "tts",
      "paragraph": 1.0,
      "parenthetical": 0.15,
      "sentence": 0.6,
      "voice_change": 0.15,
      "weak": 0.15
    },
    "renderability_mode": "strict",
    "ssmd": {
      "parse_yaml_header": true,
      "pause_overrides": null
    },
    "text_preparation": "spokenform",
    "unit": "paragraph"
  },
  "diagnostics": [
    {
      "code": "planning.complete",
      "message": "Plan compiled without renderer or audio processing",
      "path": null,
      "severity": "info"
    }
  ],
  "document_metadata": {
    "planning": {
      "engine_independent": true,
      "linguistic_passes": 2,
      "pass_a_tokens": 1,
      "renderability": {
        "checked_segments": 1,
        "guaranteed": true,
        "mode": "strict",
        "repair_count": 0
      }
    }
  },
  "format": "utterplan",
  "languages": [
    {
      "id": "lang-0",
      "language": "en-us",
      "source": "document-default",
      "spoken_end": 6,
      "spoken_start": 0
    }
  ],
  "linguistic_runs": [
    {
      "language_run_id": "lang-0",
      "model": null,
      "model_version": null,
      "provider": "fallback",
      "provider_version": null,
      "token_end": 1,
      "token_start": 0
    }
  ],
  "markers": [],
  "plan_id": "sha256:ec0de89822a789d786b8caac6cd470fcdc1b7dd8e535fc6d7267185f6686919f",
  "preparation": {
    "backend": "spokenform",
    "languages": ["en-us"],
    "replacements": [],
    "version": "0.4.5",
    "warnings": []
  },
  "producer": {
    "name": "utterplan",
    "version": "0.3.7"
  },
  "schema_version": 4,
  "segments": [
    {
      "annotation_ids": [],
      "clause": 0,
      "directives": {},
      "id": "seg-000000",
      "language": "en-us",
      "paragraph": 0,
      "pause_after": {
        "events": [],
        "seconds": 0.0
      },
      "pause_before": {
        "events": [],
        "seconds": 0.0
      },
      "sentence": 0,
      "spoken_end": 6,
      "spoken_start": 0,
      "structural_end": 6,
      "structural_start": 0,
      "text": "Hello.",
      "token_indices": [0]
    }
  ],
  "semantic_boundaries": [],
  "source": {
    "format": "plain",
    "text": "Hello."
  },
  "texts": {
    "spoken": "Hello.",
    "structural": "Hello."
  },
  "tokens": [
    {
      "id": "token-0",
      "language": "en-us",
      "lemma": "hello.",
      "morph": null,
      "spoken_end": 6,
      "spoken_start": 0,
      "text": "Hello."
    }
  ],
  "units": [
    {
      "content_hash": "sha256:22fb6815b14b614386d5eb4004f8f8d7b5ed60d86429b7067fee11d2d47ca4ad",
      "content_hash_schema": "utterplan-unit-v3",
      "id": "unit-0000",
      "index": 0,
      "kind": "paragraph",
      "marker_ids": [],
      "segment_ids": ["seg-000000"],
      "spoken_end": 6,
      "spoken_start": 0
    }
  ],
  "warnings": []
}
