{
  "annotations": [],
  "boundaries": [
    {
      "attrs": {
        "anchor": "after",
        "pause_origin": "explicit",
        "time": "500ms"
      },
      "id": "boundary-000000",
      "kind": "explicit",
      "origin": "ssmd",
      "position": 5,
      "seconds": 0.5,
      "strength": null
    },
    {
      "attrs": {
        "anchor": "after",
        "pause_origin": "none",
        "strength": "none"
      },
      "id": "boundary-000001",
      "kind": "explicit",
      "origin": "ssmd",
      "position": 11,
      "seconds": null,
      "strength": "none"
    }
  ],
  "config": {
    "diagnostics": true,
    "document_format": "ssmd",
    "language": "en-us",
    "language_aliases": {},
    "linguistics": {
      "require_spacy": false,
      "spacy_model": null,
      "spacy_model_size": null,
      "use_spacy": null
    },
    "overlap_mode": "snap",
    "pauses": {
      "clause": 0.3,
      "enabled": true,
      "mode": "tts",
      "paragraph": 1.0,
      "parenthetical": 0.15,
      "sentence": 0.6,
      "voice_change": 0.15,
      "weak": 0.15
    },
    "renderability_mode": "strict",
    "ssmd": {
      "parse_yaml_header": true,
      "pause_overrides": null
    },
    "text_preparation": "spokenform",
    "unit": "paragraph"
  },
  "diagnostics": [
    {
      "code": "planning.complete",
      "message": "Plan compiled without renderer or audio processing",
      "path": null,
      "severity": "info"
    }
  ],
  "document_metadata": {
    "header": {},
    "planning": {
      "engine_independent": true,
      "linguistic_passes": 2,
      "pass_a_tokens": 3,
      "renderability": {
        "checked_segments": 3,
        "guaranteed": true,
        "mode": "strict",
        "repair_count": 0
      }
    },
    "sequence_fallback_mode": "spell"
  },
  "format": "utterplan",
  "languages": [
    {
      "id": "lang-0",
      "language": "en-us",
      "source": "document-default",
      "spoken_end": 18,
      "spoken_start": 0
    }
  ],
  "linguistic_runs": [
    {
      "language_run_id": "lang-0",
      "model": null,
      "model_version": null,
      "provider": "fallback",
      "provider_version": null,
      "token_end": 3,
      "token_start": 0
    }
  ],
  "markers": [],
  "plan_id": "sha256:97e1a40edd2d2da442a1916e46190048a1d304c28d7ad0fd9fcbdf35330e6015",
  "preparation": {
    "backend": "spokenform",
    "languages": ["en-us"],
    "replacements": [],
    "version": "0.4.5",
    "warnings": []
  },
  "producer": {
    "name": "utterplan",
    "version": "0.3.7"
  },
  "schema_version": 4,
  "segments": [
    {
      "annotation_ids": [],
      "clause": 0,
      "directives": {},
      "id": "seg-000000",
      "language": "en-us",
      "paragraph": 0,
      "pause_after": {
        "events": ["boundary-000000"],
        "seconds": 0.5
      },
      "pause_before": {
        "events": [],
        "seconds": 0.0
      },
      "sentence": 0,
      "spoken_end": 5,
      "spoken_start": 0,
      "structural_end": 5,
      "structural_start": 0,
      "text": "Hello",
      "token_indices": [0]
    },
    {
      "annotation_ids": [],
      "clause": 1,
      "directives": {},
      "id": "seg-000001",
      "language": "en-us",
      "paragraph": 0,
      "pause_after": {
        "events": ["boundary-000001"],
        "seconds": 0.15
      },
      "pause_before": {
        "events": [],
        "seconds": 0.0
      },
      "sentence": 0,
      "spoken_end": 11,
      "spoken_start": 5,
      "structural_end": 11,
      "structural_start": 5,
      "text": " world",
      "token_indices": [1]
    },
    {
      "annotation_ids": [],
      "clause": 2,
      "directives": {},
      "id": "seg-000002",
      "language": "en-us",
      "paragraph": 0,
      "pause_after": {
        "events": [],
        "seconds": 0.0
      },
      "pause_before": {
        "events": [],
        "seconds": 0.0
      },
      "sentence": 0,
      "spoken_end": 18,
      "spoken_start": 11,
      "structural_end": 18,
      "structural_start": 11,
      "text": " again.",
      "token_indices": [2]
    }
  ],
  "semantic_boundaries": [],
  "source": {
    "format": "ssmd",
    "text": "Hello ...500ms world ...n again."
  },
  "texts": {
    "spoken": "Hello world again.",
    "structural": "Hello world again."
  },
  "tokens": [
    {
      "id": "token-0",
      "language": "en-us",
      "lemma": "hello",
      "morph": null,
      "spoken_end": 5,
      "spoken_start": 0,
      "text": "Hello"
    },
    {
      "id": "token-1",
      "language": "en-us",
      "lemma": "world",
      "morph": null,
      "spoken_end": 11,
      "spoken_start": 6,
      "text": "world"
    },
    {
      "id": "token-2",
      "language": "en-us",
      "lemma": "again.",
      "morph": null,
      "spoken_end": 18,
      "spoken_start": 12,
      "text": "again."
    }
  ],
  "units": [
    {
      "content_hash": "sha256:618af600551e6dc83a3874c072929c3be2b84afc0d6e28f269a0f29741c413b4",
      "content_hash_schema": "utterplan-unit-v3",
      "id": "unit-0000",
      "index": 0,
      "kind": "paragraph",
      "marker_ids": [],
      "segment_ids": ["seg-000000", "seg-000001", "seg-000002"],
      "spoken_end": 18,
      "spoken_start": 0
    }
  ],
  "warnings": []
}
